{
  "$schema": "./website-catalog.schema.json",
  "schemaVersion": 1,
  "catalogId": "website-qa-baseline",
  "catalogVersion": "1.1.0",
  "status": "stable",
  "description": "Bewusst begrenzter stabiler Basiskatalog für HTTP-, Crawl-, Browser- und Social-bezogene sowie bewusst nicht automatisierbare Website-Prüfnachweise.",
  "items": [
    {
      "id": "CORE-DOM-02",
      "module": "core",
      "statement": "HTTP leitet dauerhaft, pfad- und queryerhaltend und möglichst ohne unnötige Zwischenstation auf HTTPS um.",
      "criteria": [
        {
          "id": "CORE-DOM-02/C1",
          "statement": "Die geprüfte HTTP-Variante verwendet eine permanente Weiterleitung auf HTTPS.",
          "verification": {
            "mode": "automatic",
            "assertions": ["http.redirect.permanent"],
            "aggregation": "all"
          }
        },
        {
          "id": "CORE-DOM-02/C2",
          "statement": "Pfad und Query bleiben bei der geprüften HTTP-zu-HTTPS-Weiterleitung erhalten.",
          "verification": {
            "mode": "automatic",
            "assertions": ["http.redirect.path-query-preserved"],
            "aggregation": "all"
          }
        }
      ]
    },
    {
      "id": "CORE-DOM-04",
      "module": "core",
      "statement": "Zertifikat, Zertifikatskette, Hostabdeckung und unterstützte TLS-Versionen sind mit einem geeigneten Werkzeug geprüft. Die automatische Verlängerung ist durch Konfiguration oder einen erfolgreichen Erneuerungsnachweis plausibilisiert.",
      "criteria": [
        {
          "id": "CORE-DOM-04/C1",
          "statement": "Zertifikat, Zertifikatskette, Hostabdeckung und TLS-Versionen wurden für die vorgesehenen Hosts geprüft.",
          "verification": {
            "mode": "external",
            "evidenceClass": "infrastructure-access",
            "instructions": "Nachweis eines geeigneten TLS-Werkzeugs mit Datum, Hosts und Ergebnis referenzieren."
          }
        },
        {
          "id": "CORE-DOM-04/C2",
          "statement": "Die automatische Zertifikatserneuerung ist durch Infrastrukturkonfiguration oder einen erfolgreichen Erneuerungsvorgang plausibilisiert.",
          "verification": {
            "mode": "manual",
            "evidenceClass": "administrative",
            "instructions": "Plattformkonfiguration oder Erneuerungsnachweis ohne Zugangsdaten dokumentieren."
          }
        }
      ]
    },
    {
      "id": "CORE-DOM-05",
      "module": "core",
      "statement": "Jede indexierbare Seite enthält genau einen absoluten Canonical auf der festgelegten Host- und HTTPS-Variante.",
      "criteria": [
        {
          "id": "CORE-DOM-05/C1",
          "statement": "Alle vom Crawl geprüften indexierbaren Seiten besitzen genau einen absoluten Canonical.",
          "verification": {
            "mode": "automatic",
            "assertions": ["crawl.canonical.single-absolute"],
            "aggregation": "all"
          }
        },
        {
          "id": "CORE-DOM-05/C2",
          "statement": "Die geprüften Canonicals entsprechen der jeweiligen finalen Seiten-URL.",
          "verification": {
            "mode": "automatic",
            "assertions": ["crawl.canonical.matches-final-url"],
            "aggregation": "all"
          }
        },
        {
          "id": "CORE-DOM-05/C3",
          "statement": "Die finalen Seiten-URLs entsprechen der projektspezifisch festgelegten öffentlichen Host-, HTTPS- und Pfadstrategie.",
          "verification": {
            "mode": "manual",
            "evidenceClass": "project-review",
            "instructions": "Crawlziel und finale URL-Stichprobe mit der dokumentierten öffentlichen URL-Strategie des Projekts abgleichen."
          }
        }
      ]
    },
    {
      "id": "CORE-DOM-07",
      "module": "core",
      "statement": "Weiterleitungen wurden auf Statuscode, Pfad- und Queryerhalt, Schleifen und unnötige Ketten geprüft.",
      "criteria": [
        {
          "id": "CORE-DOM-07/C1",
          "statement": "Die geprüfte HTTPS-Navigation enthält keinen Downgrade auf HTTP.",
          "verification": {
            "mode": "automatic",
            "assertions": ["https.redirect.no-downgrade"],
            "aggregation": "all"
          }
        },
        {
          "id": "CORE-DOM-07/C2",
          "statement": "Die geprüfte Zielnavigation enthält keine unnötige Weiterleitungskette.",
          "verification": {
            "mode": "automatic",
            "assertions": ["https.redirect.chain-direct"],
            "aggregation": "all"
          }
        },
        {
          "id": "CORE-DOM-07/C3",
          "statement": "Die geprüfte HTTP-zu-HTTPS-Navigation enthält keine unnötige Weiterleitungskette.",
          "verification": {
            "mode": "automatic",
            "assertions": ["http.redirect.chain-direct"],
            "aggregation": "all"
          }
        },
        {
          "id": "CORE-DOM-07/C4",
          "statement": "Alle veröffentlichten Host- und Routenvarianten, die zum Projektumfang gehören, wurden inventarisiert und geprüft.",
          "verification": {
            "mode": "manual",
            "evidenceClass": "project-review",
            "instructions": "Geprüfte Hosts und projektspezifische Redirectrouten mit Ergebnis dokumentieren."
          }
        }
      ]
    },
    {
      "id": "CORE-DOM-08",
      "module": "core",
      "statement": "HSTS-Wert und Reichweite sind bewusst gewählt und auf allen relevanten HTTPS-Antworten einschließlich vorgeschalteter Weiterleitungshosts geprüft. `includeSubDomains` und `preload` werden nur nach Prüfung aller betroffenen Subdomains aktiviert.",
      "criteria": [
        {
          "id": "CORE-DOM-08/C1",
          "statement": "HSTS ist auf allen vom HTTP-Prüfer untersuchten HTTPS-Antwortklassen vorhanden.",
          "verification": {
            "mode": "automatic",
            "assertions": ["http.security.selected-response-coverage-complete", "http.hsts.present"],
            "aggregation": "all"
          }
        },
        {
          "id": "CORE-DOM-08/C2",
          "statement": "Der HSTS-max-age ist syntaktisch gültig und beträgt mindestens 180 Tage.",
          "verification": {
            "mode": "automatic",
            "assertions": ["http.security.selected-response-coverage-complete", "http.hsts.max-age-adequate"],
            "aggregation": "all"
          }
        },
        {
          "id": "CORE-DOM-08/C3",
          "statement": "Relevante HTTPS-Antwortklassen und vorgeschaltete Weiterleitungshosts wurden projektspezifisch bestimmt.",
          "verification": {
            "mode": "manual",
            "evidenceClass": "infrastructure-access",
            "instructions": "Antwortklassen, Hosts und nicht erreichbare Infrastrukturgrenzen dokumentieren."
          }
        },
        {
          "id": "CORE-DOM-08/C4",
          "statement": "includeSubDomains und preload wurden anhand aller betroffenen Subdomains bewusst entschieden.",
          "verification": {
            "mode": "manual",
            "evidenceClass": "administrative",
            "instructions": "Entscheidung, Subdomaininventar und verantwortliche Stelle dokumentieren."
          }
        }
      ]
    },
    {
      "id": "CORE-ERR-01",
      "module": "core",
      "statement": "Eine unbekannte Browserroute liefert eine verständliche HTML-Fehlerseite mit tatsächlichem HTTP-404-Status und ohne interne technische Details.",
      "criteria": [
        {
          "id": "CORE-ERR-01/C1",
          "statement": "Der geprüfte unbekannte Pfad antwortet mit HTTP 404.",
          "verification": {
            "mode": "automatic",
            "assertions": ["error.not-found.status-404"],
            "aggregation": "all"
          }
        },
        {
          "id": "CORE-ERR-01/C2",
          "statement": "Die automatische Stichprobe erkennt keine typischen Stacktraces oder internen Dateipfade.",
          "verification": {
            "mode": "automatic",
            "assertions": ["error.not-found.no-technical-details"],
            "aggregation": "all"
          }
        },
        {
          "id": "CORE-ERR-01/C3",
          "statement": "Die Fehlerseite ist für die vorgesehenen Nutzer verständlich und enthält keine projektspezifisch sensiblen Details.",
          "verification": {
            "mode": "manual",
            "evidenceClass": "editorial",
            "instructions": "Fehlerseite visuell und redaktionell prüfen; automatische Mustererkennung genügt nicht."
          }
        }
      ]
    },
    {
      "id": "CORE-ERR-02",
      "module": "core",
      "statement": "Nicht indexierbare Fehlerseiten senden `noindex` und enthalten weder einen irreführenden Canonical noch `og:url` auf die Fehleradresse.",
      "criteria": [
        {
          "id": "CORE-ERR-02/C1",
          "statement": "Die geprüfte 404-Antwort enthält eine noindex-Anweisung.",
          "verification": {
            "mode": "automatic",
            "assertions": ["error.not-found.noindex"],
            "aggregation": "all"
          }
        },
        {
          "id": "CORE-ERR-02/C2",
          "statement": "Die geprüfte 404-Antwort enthält weder Canonical noch og:url.",
          "verification": {
            "mode": "automatic",
            "assertions": ["error.not-found.no-url-metadata"],
            "aggregation": "all"
          }
        }
      ]
    },
    {
      "id": "CORE-ERR-03",
      "module": "core",
      "statement": "API-, Asset- und Content-Negotiation-Fehler liefern passende Statuscodes und Medientypen statt einer scheinbar erfolgreichen HTML-Antwort.",
      "criteria": [
        {
          "id": "CORE-ERR-03/C1",
          "statement": "Alle vom Crawl geprüften internen Seitenressourcen antworten erfolgreich und verwenden einen zum Einbindungszweck passenden MIME-Typ.",
          "verification": {
            "mode": "automatic",